{"schema_version":"kaiba.provisioning.rpi5-stable-verifier-policy/v1alpha1","policy_id":"policy:development-pi5-20260915","device_class":"raspberry-pi-5-model-b-v1alpha1","cohort_id":"development-pi5","security_epoch":2,"minimum_verifier_version":1,"release_signature_threshold":1,"allowed_slot_ids":["a"],"root_key_id":"root-vm","root_key_fingerprint":"sha256:7b47962aa6703403156ce19c111418d27edba56b43259d710e2ba05136f4877d","delegated_keys":[{"key_id":"release-development-replacement-20260915","algorithm":"rsa-2048-sha256-pkcs1v15","public_key_pem":"-----BEGIN PUBLIC KEY-----\nMIIBIjANBgkqhkiG9w0BAQEFAAOCAQ8AMIIBCgKCAQEAk2k7tjlZZ1RlEVf8ceX0\nRg+closr4jDWCCao9ON2/htbE6ScO/KvkMA1nYz4rvecUyka0VcyV8R9lvqaY5rp\nBDPFQhHTPf2g6xcIgr8gFv4FaDHFDc7AWHb3PrpUFd8HpmWYvk+35lM2uFlJ4HPP\n7YYiKdw8cidmZdHAEMFi90MPVqfaM0skWjLWoFsPSCW1kWkesUM62CBoKZTRrlqR\n26NNzICcnQKsscCMCTLyORXQQS4+C/mhfUagRXOoPzK0rKfz7EbChbALtZaJ6DoJ\ni2x9oDq2yz7MBDIS94PpcmALh3Altn8AwTMmq1TeJoMHF3T5l8YwCxmEAa6kPI0D\nBwIDAQAB\n-----END PUBLIC KEY-----\n","public_key_fingerprint":"sha256:08c9f15edc0f2820ffa1b14da9464ef64f64f19641cc44599ecaab1d9ffdd7b5","status":"active"},{"key_id":"release-development-revoked-20260915","algorithm":"rsa-2048-sha256-pkcs1v15","public_key_pem":"-----BEGIN PUBLIC KEY-----\nMIIBIjANBgkqhkiG9w0BAQEFAAOCAQ8AMIIBCgKCAQEAq+0beCDU06eUAKol+MTB\nInmWIdk56gFyKcRbflBCXnt5q6LKnvPa97OIsgjlH98i8EKDv6zXFEyuH4tjk6Cn\n/a+RsS4yxIv57rxxs2FWIYImIqgiSLA+iuILf/zRXZhRt5hUdhxZgIqFV71YYXDz\nK2QyCL4ktriKJz097DpQUGskPzp1hIvlyV/X45nEX+RN+fMpGZY7hgnHpBZ+czZt\nG90B5w5CktSpR3iem+GMXpdlZ0dbyp6er025oOJUDnADTldbMdcV7cR6N9+0Go07\n5BQyKD8yt1YvIJO1lsCEf0D/FEalx9htt+5R+jp5JaoK1YfUrFfRSAtK+lgB7q8b\nHwIDAQAB\n-----END PUBLIC KEY-----\n","public_key_fingerprint":"sha256:169860b1b6a3c8507e38a75779a253e66f9d388eeb5d5877edd71b79a73e114b","status":"revoked"},{"key_id":"release-vm","algorithm":"rsa-2048-sha256-pkcs1v15","public_key_pem":"-----BEGIN PUBLIC KEY-----\nMIIBIjANBgkqhkiG9w0BAQEFAAOCAQ8AMIIBCgKCAQEA1VmxNhbiC3xhDvHrL1FI\njL+WWhAqfr5I4fjQ4+gZSyY4GW3L5LUGbrnF6MuACVa9DYiH2bjLgwBfxFdbxcg3\ngVQEr2B6Po6Lsc2Wt1DxMzYhYhUAr6csdeIkId7Lt8MoLOSzToYGHkwMym6YRKLl\n0UPCpU6nUKQEnHtiPvt2enEybjwYzW1IMrhgIMnwYjp0be5mPQhlqLN+RRgRAwxg\nIH3jq/3qUTxlXXvHOlmGD3VKsQcs24rS5CaK20UYlXiPanX0imGp+F0CLnL/DuUz\nbjihmv3YXJN0VCkjWMyn+EGr75L0HFaySRX/wbzG2ECdDUalxVIA18ulFxkmdlWa\nFQIDAQAB\n-----END PUBLIC KEY-----\n","public_key_fingerprint":"sha256:aed0216b5d47b953e865dfdf828d672d4e5edd6cba9e1ff3dabd68ceab0037d2","status":"active"}],"authorization_authorities":[{"key_id":"development-authority-20260908","algorithm":"ed25519","public_key":"ed25519:925e801dc773a46dbfac14e838cb13404539202696e5dcf086ac38204bbecaca"}],"root_signature":{"key_id":"root-vm","algorithm":"rsa-2048-sha256-pkcs1v15","value":"dKeXpnSFlUrPZh51FO5a/TnnUKSMOWuHSCMhYsRxpGGpCVPV3QRAXTR06skkGjV/rMAXp592wAt2Ks+sFn8uOpdNX7Wqo4VAUKk4sy9SWMiuIHG7XY4rXSHNTLe7nt9QJTmnErH2J6Gi0jC2CyjEmXGZNJSYDKAmZlWwqb41DgMlPI/SyoKo2yGAFnPdQ7Hzc3xkE66QQwPCbtgGLeg75B8L6xhNTjjlvb9FnV72yZDBVxWxQ84kQXt6PCW2/Qi6foOVe4XUA64RMWiF7gwsFBsma1h1zq3A1twHI0W64mvBXn+bkYdD4b/ap4kXz6rsaxOKASN5NXZJ7WC6swYgkA=="}}